{
  "$schema": "https://json-schema.org/draft/2020-12/schema",
  "$id": "https://contracts.loan-platform.example/schemas/policies/quick-personal-loan-policy.v1.schema.json",
  "title": "QuickPersonalLoanPolicy.v1",
  "type": "object",
  "additionalProperties": false,
  "properties": {
    "policyId": {
      "const": "quick-personal-loan-demo"
    },
    "policyVersion": {
      "type": "string",
      "pattern": "^1\\.\\d+\\.\\d+$"
    },
    "rulesetVersion": {
      "type": "string",
      "pattern": "^m1-ruleset-v1\\.\\d+\\.\\d+$"
    },
    "effectiveFrom": {
      "type": "string",
      "format": "date-time",
      "pattern": "^\\d{4}-\\d{2}-\\d{2}T\\d{2}:\\d{2}:\\d{2}(?:\\.\\d+)?Z$"
    },
    "product": {
      "type": "object",
      "additionalProperties": false,
      "properties": {
        "productId": {
          "const": "quick-personal-loan-demo"
        },
        "minimumAmount": {
          "type": "number",
          "minimum": 0,
          "multipleOf": 0.01
        },
        "maximumAmount": {
          "type": "number",
          "minimum": 0,
          "multipleOf": 0.01
        },
        "currency": {
          "const": "XTS"
        },
        "supportedTermMonths": {
          "type": "array",
          "minItems": 1,
          "uniqueItems": true,
          "items": {
            "type": "integer",
            "minimum": 1
          }
        },
        "lowFrictionThreshold": {
          "type": "number",
          "minimum": 0,
          "multipleOf": 0.01
        }
      },
      "required": [
        "productId",
        "minimumAmount",
        "maximumAmount",
        "currency",
        "supportedTermMonths",
        "lowFrictionThreshold"
      ]
    },
    "eligibility": {
      "type": "object",
      "additionalProperties": false,
      "properties": {
        "minimumAgeAtApplication": {
          "type": "integer",
          "minimum": 1
        },
        "maximumAgeAtMaturity": {
          "type": "integer",
          "minimum": 1
        },
        "minimumIncome": {
          "type": "number",
          "minimum": 0,
          "multipleOf": 0.01
        },
        "maximumActiveApplicationsPerCustomer": {
          "type": "integer",
          "minimum": 0
        },
        "maximumActiveLoansPerCustomer": {
          "type": "integer",
          "minimum": 0
        },
        "supportedMarkets": {
          "type": "array",
          "minItems": 1,
          "uniqueItems": true,
          "items": {
            "type": "string",
            "pattern": "^TEST-[A-Z0-9-]+$"
          }
        }
      },
      "required": [
        "minimumAgeAtApplication",
        "maximumAgeAtMaturity",
        "minimumIncome",
        "maximumActiveApplicationsPerCustomer",
        "maximumActiveLoansPerCustomer",
        "supportedMarkets"
      ]
    },
    "risk": {
      "type": "object",
      "additionalProperties": false,
      "properties": {
        "minimumValidScore": {
          "type": "integer",
          "minimum": 0,
          "maximum": 1000
        },
        "maximumValidScore": {
          "type": "integer",
          "minimum": 0,
          "maximum": 1000
        },
        "minimumEligibleScore": {
          "type": "integer",
          "minimum": 0,
          "maximum": 1000
        },
        "riskBands": {
          "type": "array",
          "minItems": 3,
          "maxItems": 3,
          "items": {
            "type": "object",
            "additionalProperties": false,
            "properties": {
              "band": {
                "type": "string",
                "enum": [
                  "Low",
                  "Medium",
                  "High"
                ]
              },
              "minimumScore": {
                "type": "integer",
                "minimum": 0
              },
              "maximumScore": {
                "type": "integer",
                "minimum": 0,
                "maximum": 1000
              },
              "paymentToIncomeLimit": {
                "type": "number",
                "exclusiveMinimum": 0,
                "maximum": 1
              },
              "exposureCap": {
                "type": "number",
                "exclusiveMinimum": 0,
                "multipleOf": 0.01
              },
              "permittedTermMonths": {
                "type": "array",
                "minItems": 1,
                "uniqueItems": true,
                "items": {
                  "type": "integer",
                  "minimum": 1
                }
              },
              "baseMonthlyEffectiveRate": {
                "type": "number",
                "minimum": 0,
                "maximum": 1,
                "multipleOf": 0.000001
              }
            },
            "required": [
              "band",
              "minimumScore",
              "maximumScore",
              "paymentToIncomeLimit",
              "exposureCap",
              "permittedTermMonths",
              "baseMonthlyEffectiveRate"
            ]
          }
        }
      },
      "required": [
        "minimumValidScore",
        "maximumValidScore",
        "minimumEligibleScore",
        "riskBands"
      ]
    },
    "alternatives": {
      "type": "object",
      "additionalProperties": false,
      "properties": {
        "segmentRules": {
          "type": "array",
          "minItems": 3,
          "maxItems": 3,
          "items": {
            "type": "object",
            "additionalProperties": false,
            "properties": {
              "segment": {
                "type": "string",
                "enum": [
                  "New",
                  "Standard",
                  "Preferred"
                ]
              },
              "exposureCap": {
                "type": "number",
                "exclusiveMinimum": 0,
                "multipleOf": 0.01
              },
              "rateAdjustmentPercentagePoints": {
                "type": "number",
                "minimum": -1,
                "maximum": 1,
                "multipleOf": 0.000001
              }
            },
            "required": [
              "segment",
              "exposureCap",
              "rateAdjustmentPercentagePoints"
            ]
          }
        },
        "maximumCount": {
          "type": "integer",
          "minimum": 1,
          "maximum": 3
        },
        "objectives": {
          "type": "array",
          "minItems": 1,
          "maxItems": 3,
          "uniqueItems": true,
          "items": {
            "type": "string",
            "enum": ["RequestedOrMaximumAmount", "LowestInstallment", "LowestTotalCost"]
          }
        }
      },
      "required": [
        "segmentRules",
        "maximumCount",
        "objectives"
      ]
    },
    "offer": {
      "type": "object",
      "additionalProperties": false,
      "properties": {
        "validityDuration": {
          "type": "string",
          "pattern": "^PT[1-9]\\d*H$"
        }
      },
      "required": [
        "validityDuration"
      ]
    },
    "pricing": {
      "type": "object",
      "additionalProperties": false,
      "properties": {
        "minimumMonthlyEffectiveRate": {
          "type": "number",
          "minimum": 0,
          "maximum": 1,
          "multipleOf": 0.000001
        }
      },
      "required": [
        "minimumMonthlyEffectiveRate"
      ]
    },
    "calculation": {
      "type": "object",
      "additionalProperties": false,
      "properties": {
        "formulaVersions": {
          "type": "array",
          "minItems": 1,
          "uniqueItems": true,
          "items": {
            "type": "string",
            "pattern": "^[a-z][a-z0-9-]*-v1\\.\\d+\\.\\d+$"
          }
        },
        "roundingMode": {
          "const": "MidpointAwayFromZero:2dp"
        }
      },
      "required": [
        "formulaVersions",
        "roundingMode"
      ]
    },
    "reasonCodeCatalogVersion": {
      "type": "string",
      "pattern": "^reason-codes-v1\\.\\d+\\.\\d+$"
    },
    "checksum": {
      "type": "string",
      "pattern": "^sha256:[0-9a-f]{64}$"
    }
  },
  "required": [
    "policyId",
    "policyVersion",
    "rulesetVersion",
    "effectiveFrom",
    "product",
    "eligibility",
    "risk",
    "alternatives",
    "offer",
    "pricing",
    "calculation",
    "reasonCodeCatalogVersion",
    "checksum"
  ]
}
