{
  "policyId": "quick-personal-loan-demo",
  "policyVersion": "1.0.0",
  "rulesetVersion": "m1-ruleset-v1.0.0",
  "effectiveFrom": "2026-08-19T00:00:00Z",
  "product": {
    "productId": "quick-personal-loan-demo",
    "minimumAmount": 100.00,
    "maximumAmount": 2000.00,
    "currency": "XTS",
    "supportedTermMonths": [3, 6, 9, 12],
    "lowFrictionThreshold": 1000.00
  },
  "eligibility": {
    "minimumAgeAtApplication": 18,
    "maximumAgeAtMaturity": 70,
    "minimumIncome": 500.00,
    "maximumActiveApplicationsPerCustomer": 1,
    "maximumActiveLoansPerCustomer": 1,
    "supportedMarkets": ["TEST-MARKET"]
  },
  "risk": {
    "minimumValidScore": 0,
    "maximumValidScore": 1000,
    "minimumEligibleScore": 500,
    "riskBands": [
      {
        "band": "Low",
        "minimumScore": 750,
        "maximumScore": 1000,
        "paymentToIncomeLimit": 0.35,
        "exposureCap": 2000.00,
        "permittedTermMonths": [3, 6, 9, 12],
        "baseMonthlyEffectiveRate": 0.017
      },
      {
        "band": "Medium",
        "minimumScore": 600,
        "maximumScore": 749,
        "paymentToIncomeLimit": 0.30,
        "exposureCap": 1400.00,
        "permittedTermMonths": [3, 6, 9, 12],
        "baseMonthlyEffectiveRate": 0.019
      },
      {
        "band": "High",
        "minimumScore": 500,
        "maximumScore": 599,
        "paymentToIncomeLimit": 0.25,
        "exposureCap": 700.00,
        "permittedTermMonths": [3, 6],
        "baseMonthlyEffectiveRate": 0.021
      }
    ]
  },
  "alternatives": {
    "segmentRules": [
      { "segment": "New", "exposureCap": 800.00, "rateAdjustmentPercentagePoints": 0.000 },
      { "segment": "Standard", "exposureCap": 1400.00, "rateAdjustmentPercentagePoints": 0.000 },
      { "segment": "Preferred", "exposureCap": 2000.00, "rateAdjustmentPercentagePoints": -0.002 }
    ],
    "maximumCount": 3,
    "objectives": ["RequestedOrMaximumAmount", "LowestInstallment", "LowestTotalCost"]
  },
  "offer": { "validityDuration": "PT24H" },
  "pricing": { "minimumMonthlyEffectiveRate": 0.015 },
  "calculation": {
    "formulaVersions": ["payment-capacity-v1.0.0", "present-value-v1.0.0", "canonical-terms-hash-v1.0.0"],
    "roundingMode": "MidpointAwayFromZero:2dp"
  },
  "reasonCodeCatalogVersion": "reason-codes-v1.0.0",
  "checksum": "sha256:5b3d3ec0e90b6f6d279f3c4ddf4c13217fb934821d1105872398e6b42db6b881"
}
